ID, question, Option 1, Option 2, Option 3, Option 4, Option 5, Answer
1,"There is a tremendous gap between youth and the elderly in all of the following EXCEPT","political knowledge.","political participation.","political interest.","volunteering.","media use.","volunteering."
2,"Political knowledge","is greater among youth than the elderly.","fosters political tolerance.","is not that important in a democracy.","is generally high in the United States.","none of the above","fosters political tolerance."
3,"Voter turnout matters because","federal funds are allocated on the basis of the number of voters in a congressional district.","better candidates are selected when more people vote.","politicians pay more attention to those who vote than to those who do not vote.","it makes citizens feel better.","it makes our country look better.","politicians pay more attention to those who vote than to those who do not vote."
4,"Government is defined as the","organization that brings problems to the attention of public officials.","body that is concerned with economic problems while leaving social problems to other institutions of society.","agency that implements policies that have been enacted by other institutions of the political system.","executive branch and its agencies.","institutions and processes through which public policies are made for society.","institutions and processes through which public policies are made for society."
5,"The policymaking institutions of the American national government include all of thefollowing EXCEPT","the Supreme Court.","the presidency.","political parties.","Congress.","the Senate.","political parties."
6,"One advantage of the Internet for democracy is that it","provides less information than newspapers.","makes it easy to avoid political topics.","makes it easier for citizens to communicate directly with government.","will provide more political information to political elites.","none of the above","makes it easier for citizens to communicate directly with government."
7,"Things that are indivisible, nonexclusive, and that everyone can share are called","intangible property.","socialized.","community property.","communist.","public goods.","public goods."
8,"Governments in the modern world, whether democratic or not, are similar in doing all of thefollowing EXCEPT","protecting citizens ¹ civil liberties.","maintaining a national defense.","providing public goods.","collecting taxes.","providing public services.","protecting citizens ¹ civil liberties."
9,"A public good is defined as","something in which any member of society can share.","something provided by the government that cannot be provided by the private sector.","a choice that government makes in response to a political issue.","a public policy that is good for the nation as a whole.","all of the above","something in which any member of society can share."
10,"Which of the following statements about public goods is FALSE?","The government usually provides public goods.","Public goods are things that everyone can share.","Individuals have powerful incentives to provide public goods.","Public goods are not profitable.","Public goods are indivisible and nonexclusive.","Individuals have powerful incentives to provide public goods."
11,"All governments","provide public goods and socialize citizens into the political and social system.","ensure safety on the high seas and promote free enterprise.","maintain national parks and a national defense.","guarantee a capitalist economy and collect taxes.","hold elections.","provide public goods and socialize citizens into the political and social system."
12,"All governments","have written constitutions.","are elected.","have a legislature.","provide services.","have a president.","provide services."
13,"Which of the following statements about taxes is TRUE?","One out of every three dollars earned by an American citizen is used to pay taxes.","Despite the image presented by the media, survey data reveal that Americans feel they are getting their money's worth for the taxes they pay.","About one-tenth of the average American citizen's salary goes to taxes.","The tax burden in the United States is higher than in most other democratic nations.","All of these are true.","One out of every three dollars earned by an American citizen is used to pay taxes."
14,"An interest group so single-minded that its members often vote on only one issue, ignoring apolitician's stand on everything else, is known as","a one-issue group.","a uni-issue group.","a hot-button group.","a single-issue group.","a mono-issue group.","a single-issue group."
15,"When compared with the rest of the world, America has a relatively low","number of offices up for election.","number of candidates who seek office.","frequency of elections.","voter turnout in elections.","all of the above","voter turnout in elections."
16,"Many politicians believe that single-issue groups","stimulate the political system to solve public policy problems.","are essential to democracy.","complicate efforts to seek the middle ground on various issues.","play a unifying role in American politics.","do not affect policymaking.","complicate efforts to seek the middle ground on various issues."
17,"Politics is defined by Harold Lasswell as","conflict in society.","the exercise of power.","the resolution of conflict in a way that serves the public.","who gets what, when, and how.","a course of action to solve a problem.","who gets what, when, and how."
18,"Single-issue groups","are rapidly losing prominence in American politics.","usually run their own candidates for public office.","have little sympathy for compromising.","help facilitate the construction of a cohesive national public policy.","are highly regarded by political scientists for their contributions to democracy.","have little sympathy for compromising."
19,"Which of the following statements best describes voter turnout in the United States?","Among democratic nations, the United States leads the world in voter turnout.","Voter turnout in the United States is constitutionally mandated.","Voters are usually a microcosm of the entire body of American citizens.","Most American voters consider politics as critical to their interests.","The United States has one of the lowest voter turnout rates in the world.","The United States has one of the lowest voter turnout rates in the world."
20,"The list of problems to which political leaders are paying serious attention is a(n)","problem set.","policy agenda.","issue constellation.","legislative package.","none of the above","policy agenda."
21,"________ is the process by which policy comes into being and evolves over time.","Democracy","A policymaking system","A constellation","The bureaucracy","Government","A policymaking system"
22,"The process from above is","a policymaking system.","political decision making.","a policy agenda.","a government.","a linkage institution.","a policymaking system."
23,"An example of public policymaking would be","Congress and the president deciding not to act on the AIDS crisis.","a majority of the public supporting the idea of government dealing with unemployment.","the president meeting with the heads of oil companies.","the press creating public concern about racial discrimination.","all of the above","Congress and the president deciding not to act on the AIDS crisis."
24,"All of the following are parts of the policymaking system EXCEPT","public goods.","policymaking institutions.","linkage institutions.","people's political interests.","policy.","public goods."
25,"Which of the following statements about a government's policy agenda is FALSE?","When you vote, you are partly looking at whether a candidate shares your agenda or not.","Bad news gets an issue on the policy agenda more quickly than good news.","When people confront government officials with problems to be solved, they are trying to influence the government's policy agenda.","A government's policy agenda tends to remain constant over time.","None of the above; all are true.","A government's policy agenda tends to remain constant over time."
26,"A political party is a key ________ in America¹s democratic system.","stimulus-response","linkage institution","input","majoritarian inhibitor","output","linkage institution"
27,"In a democratic society, parties, elections, interest groups and the media are all examples of ________ between the preferences of citizens and the government's policy agenda.","cross-pollination","inputs and outputs","ideological bridges","obstacles","linkage institutions","linkage institutions"
28,"Which of the following is NOT a linkage institution?","political parties","the media","interest groups","Congress","All of these are linkage institutions.","Congress"
29,"Which of these is a linkage institution?","USA Today","the president's cabinet","the House of Representatives","the ambassador to France","all of the above","USA Today"
30,"Parties and interest groups","determine which issues are on the policy agenda.","are not particularly interested in the policy agenda.","work hard to get the issues they want on the policy agenda.","have no effect on the policy agenda.","determine the congressional agenda.","work hard to get the issues they want on the policy agenda."
31,"A choice that government makes in response to some issue on its agenda is called","public policy.","selective selection.","a law.","stimulus-response.","rational choice theory.","public policy."
32,"________ arise when people disagree about a problem or a public policy choice made tocombat a problem.","Revolutions","Political issues","Social crises","Governments","Wars","Political issues"
33,"A key question that confronts government regarding different public policy choices is","whether an appropriate linkage institution is willing to frame a policy.","which is the most complicated one to deal with.","which is the least complicated one to deal with.","whether or not government should do anything about them.","all of the above","whether or not government should do anything about them."
34,"Public policy is defined as a","policy directed at more than one person.","course of action to solve a problem.","set of rules and regulations issued by a government agency.","course of action by a political party.","choice that government makes in response to an issue.","choice that government makes in response to an issue."
35,"Political issues","are always acted upon by the government.","arise when people disagree about a problem or public policy choices made to combat a problem.","are limited in number in the United States.","usually emerge out of group consensus on a problem.","all of the above","arise when people disagree about a problem or public policy choices made to combat a problem."
36,"Karl Marx and Friedrich Engels published","The Communist Manifesto.","A Theory of Democracy.","The Federalist Papers.","Poor Richard's Almanac.","War and Peace.","The Communist Manifesto."
37,"One type of linkage institution is","an interest group.","a government.","a bureaucracy.","a legislature.","all of the above","an interest group."
38,"The effects a policy has on people and problems is called","policy outputs.","policy implementation.","policy issues.","policy impacts.","policy agenda.","policy impacts."
39,"The writers of the United States Constitution","were distrustful of democracy.","sought to establish the most democratic system they could.","were interested in promoting equality above all else.","patterned our government after Britain's except for the King.","believed in majority rule.","were distrustful of democracy."
40,"A means of selecting policymakers and or organizing government so that policy representsand responds to the public's preferences is","government.","politics.","public administration.","democracy.","all of the above","democracy."
41,"Which of these is NOT a criterion of traditional democratic theory, as formulated by RobertDahl?","freedom of speech and press","One person gets one vote.","Citizenship must be open to all within a nation.","Those who participate in political organizations must be representative of the general population.","Citizens must make rational choices.","Citizens must make rational choices."
42,"Which of the following is NOT one of the cornerstones of an ideal democracy?","a constitution","effective participation","citizen control of the agenda","economic equality","equality in voting","economic equality"
43,"Two of the most important principles of democratic theory are majority rule and","the plurality rule.","judicial review.","minority rights.","majority restraint.","Roberts ¹ Rules of Order.","minority rights."
44,"Which of the following takes the most positive view of democracy in the United States?","democratic centralism","pluralist theory","hyperpluralism","democratic positivism","elite theory","pluralist theory"
44,"Which of the following takes the most positive view of democracy in the United States?","democratic centralism","pluralist theory","hyperpluralism","democratic positivism","elite theory","pluralist theory"
46,"All of the following are ingredients of a pluralistic democracy EXCEPT","group competition for policy benefits.","bargaining and compromise.","majority rule.","multiple access points to policymakers.","separation of powers.","majority rule."
47,"The most fundamental element of democratic theory is","power to the people!","government efficiency.","equality.","majority rule.","access to information.","majority rule."
48,"Representation refers to","majority rule.","all policy views being included in political debate.","the protection of minority rights in a pluralist system.","electing office-holders in fair and free elections.","the correspondence between the few leaders and the many followers in a democracy.","the correspondence between the few leaders and the many followers in a democracy."
49,"Which of the following individuals have suggested that pluralist theory is less descriptive ofAmerican politics than in the past?","Anthony King","Robert Dahl","Alexis de Tocqueville","Robert Putnam","Thomas Jefferson","Robert Putnam"
50,"American government is viewed most positively by the","socialist theory.","pluralist theory.","positivist philosophy.","hyperpluralist theory.","elite and class theory.","pluralist theory."
51,"A system in which many groups make themselves heard and felt somewhere in the policyprocess is","pluralistic.","direct democracy.","hyperpluralistic.","elitist.","bureaucratic.","pluralistic."
52,"The theory that argues that group competition results in a rough approximation of the publicinterest in public policy is","hyperpluralist theory.","balance of power theory.","elite and class theory.","pluralist theory.","bureaucratic theory.","pluralist theory."
53,"Which of the following is NOT a contemporary theory of democracy?","hyperpluralism","class theory","democratic centralism","pluralism","elite theory","democratic centralism"
54,"Robert Putnam's claim that Americans are now   bowling alone   is a criticism of","pluralism.","elite theory.","hyperpluralism.","social network theory.","none of the above","pluralism."
55,"Which of the following is most fundamentally critical of American democracy?","traditional democratic theory","democratic negativism","pluralist theory","critical democratic theory","elite and class theory","elite and class theory"
56,"Many elite and class theorists believe that ________ of Americans control most governmentpolicy decisions.","5 percent","a majority","the vast middle class","1 percent","10 percent","1 percent"
57,"Over a third of America's wealth is owned by","the United States government.","one percent of the population.","a third of the population.","seven percent of the population.","Japanese investors.","one percent of the population."
58,"At the center of all theories of elite domination of politics is","big business.","the Congress.","the nouveau riche.","the Trilateral Commission.","the president.","big business."
59,"Elite and class theory holds that","all societies are divided along class lines and that an upper-class elite will rule.","power is dispersed among many institutions.","in a democracy the majority class must overthrow the government and rule by itself if government is to be freed from the control of the rich.","there is little consensus in policymaking among elites.","politics is the basis of elite power.","all societies are divided along class lines and that an upper-class elite will rule."
60,"The theory that sees wealth as the basis of power is the","democratic theory.","hyperpluralist theory.","Jeffersonian theory.","elite and class theory.","pluralist theory.","elite and class theory."
61,"Hyperpluralists believe that the dominant player in American politics is","groups.","the president.","the government.","the media.","rich individuals.","groups."
62,"In evaluating American democracy, hyperpluralists","claim that competing groups vying for power make for generally efficient, honest government.","claim that society is governed solely by an upper-class elite.","claim that too many influential groups cripple government's ability to govern.","believe that the public interest is nearly always translated into public policy in the United States.","none of the above","claim that too many influential groups cripple government's ability to govern."
63,"According to hyperpluralists, the increasing caseloads of federal and state courts demonstrate","the high status of attorneys in the United States.","the inability to control the bureaucracy in implementing policy.","that groups are more likely to appeal to different institutions in order to gain policy benefits.","the expanding scope of government in the United States.","the increasing complexity of our social networks.","the expanding scope of government in the United States."
64,"The   power of the few   in the United States today is likely to refer to","high-level bureaucrats.","elected officials.","property holders.","technical experts.","a silent majority.","technical experts."
65,"The nature of groups and the government in hyperpluralist theory is","strong government and strong groups.","weak groups and strong government.","weak groups, strong elites, and weak government.","strong groups and weak government.","too few groups result in the creation of many governments.","strong groups and weak government."
66,"Hyperpluralists would argue that","too many influential groups cripple government's ability to govern.","society is divided along class lines.","group competition will result in a rough approximation of the public interest.","wealth is the basis of power.","too few groups lead to a proliferation of governments.","too many influential groups cripple government's ability to govern."
67,"Which of these is NOT considered a challenge to democracy by the textbook?","the diversity of the American people","the level of political participation by Americans","PACs","the specialization of knowledge held by experts","the tendency of the American political system to change rapidly","the tendency of the American political system to change rapidly"
68,"Which of the following would NOT be considered a contemporary challenge to Americandemocracy?","complexity of the issues","the threat of communism","the use of money in politics","political participation rates","diversity","the threat of communism"
69,"Increased technical expertise is a challenge to democracy because","it is difficult to have an informed   non-technical   public debate on technical issues.","it goes against the tenets of pluralist political theory.","it violates the notion of one man, one vote.","elected officials find it hard to understand technical experts.","interest groups have a difficult time securing technical expertise.","it goes against the tenets of pluralist political theory."
70,"PAC stands for","Partisan Assistance Contribution.","Party Affairs Council.","Policy Advisory Commission.","Politically Active Constituency.","Political Action Committee.","Political Action Committee."
71,"People who worry about PACs are most especially concerned about","the decline in American voter turnout.","the close connection between money and politics.","too much democracy being dangerous to social stability.","the role Party Affairs Councils play in elections.","single-issue voters.","the close connection between money and politics."
72,"Escalating campaign costs are a challenge to democracy because","it is believed that PAC contributions affect the way members of Congress vote on single issues.","they are associated with more technical policies.","they lead to policy gridlock.","they reflect diverse interests.","they make it easier for candidates to raise money.","it is believed that PAC contributions affect the way members of Congress vote on single issues."
73,"According to the text, the diversity of political interests in America is resulting in","a decrease in political participation.","policy gridlock.","the breakdown of the educational system.","an increase in political participation.","a cultural renaissance.","policy gridlock."
74,"The ability of groups to prevent the government from taking actions adverse to their interestsleads to what the text calls","Dahl's   ideal democratic process.","elite dominance.","budget deficits.","enlightened understanding.","policy gridlock.","policy gridlock."
75,"The overall set of shared values in a society is known as","individualism.","value added voting.","populism.","political culture.","collectivism.","political culture."
76,"According to G.K. Chesterston, the United States is the only country in the world that isfounded on","heredity.","a creed.","isolationism.","civic virtue.","religious principles.","a creed."
77,"During the American Revolution, Patrick Henry said","We fight for truth, justice, and the American way!","Give me liberty or give me death.","I regret that I have but one life to give for my country.","Our fathers brought forth on this continent, a new nation, conceived in Liberty, and dedicated to the proposition that all men are created equal.","Live free or die.","Give me liberty or give me death."
78,"According to Thomas Jefferson, which of the following is an inalienable right?","Liberty","Taxes","Justice","Jurisprudence","Incontinence","Liberty"
79,"The Declaration of Independence says that   all men are created equal.   Which aspect of theAmerican creed does this suggest?","Individualism","Egalitarianism","Liberty","Capitalism","Populism","Liberty"
80,"One of the primary reasons for the comparatively small scope of American government is","liberalism.","pluralism.","judicial review.","capitalism.","individualism.","individualism."
81,"According to Frederick Jackson Turner, the existence of the frontier in American history mostdirectly resulted in","the abolition of slavery.","a strong preference for limited government.","the environmental movement.","the space program.","the civil rights movement.","a strong preference for limited government."
82,"Populism emphasizes","the people.","the elected officials.","representative democracy.","the meritocracy.","prosperity.","the people."
83,"Those who argue that the United States is in the midst of a culture war argue that Americansare becoming increasingly","isolationist.","secular.","hypocritical.","egalitarian.","polarized.","polarized."
84,"National, state, and local governments in America spend almost ________ of the grossdomestic product.","3 percent","30 percent","all","10 percent","none","30 percent"
85,"The United States government owns ________ of the land in the United States","all","5 percent","one-third","2 percent","none","one-third"
86,"The largest item in the United States government budget, consuming more than one -fifth ofspending, is","Social Security payments.","foreign aid.","education spending.","national defense.","welfare for the poor.","Social Security payments."
87,"The United States national government spends about ________ a year.","$4 billion","$250 billion","$1,000,000,000,000","$500 billion","$2.8 trillion","$2.8 trillion"
88,"Which of the following categories is the largest expenditure in the federal budget?","Social Security","Medicaid","environment","national defense","homeland security","Social Security"
89,"Which of these is TRUE about the United States Constitution?","It centralizes political power.","It is superseded only by decrees of the president.","It sets neutral rules for the game of politics.","All of these are true.","None of these are true.","None of these are true."
90,"In setting the broad rules of the game of politics, constitutions","are never neutral; they give some participants advantages over others.","are fair and impartial.","allow all participants the same political opportunities.","have no effect on the distribution of power in society.","are constantly changing.","are never neutral; they give some participants advantages over others."
91,"By eighteenth-century standards, life was ________ for most people in the United States at thetime of the Revolution.","hell both politically and economically","politically oppressive","ideal","not bad","an economic nightmare","not bad"
92,"The British government stepped up its controls over the American colonies with new taxesand stronger commerce regulations right after","King Phillip's War.","the assassination of the Duke of Windsor.","King George's War.","the Civil War.","the French and Indian War.","the French and Indian War."
92,"The British government stepped up its controls over the American colonies with new taxesand stronger commerce regulations right after","King Phillip's War.","the assassination of the Duke of Windsor.","King George's War.","the Civil War.","the French and Indian War.","the French and Indian War."
