ID, question, Option 1, Option 2, Option 3, Option 4, Option 5, Answer
1082,"Which of the following statements about the election of 1896 is FALSE?","The main issue in the election of 1896 was the gold standard and tariffs.","William Jennings Bryan broke with tradition and campaigned extensively in person.","The election resulted in the Democrats becoming firmly entrenched as the majority party in the Northeast and Midwest.","Nearly 80 percent of the eligible electorate voted in 1896.","none of the above","The election resulted in the Democrats becoming firmly entrenched as the majority party in the Northeast and Midwest."
1083,"The winner of the presidential election of 1896 was","Theodore Roosevelt.","William McKinley.","Grover Cleveland.","William Jennings Bryan.","Ulysses Grant.","William McKinley."
1084,"The election of 1896 left a legacy of a political alignment that endured for several decades,wherein","the Democrats won the more populous Northeast and Midwest, and the Republicans won in the South and West.","the Democrats won the South and West, while the Republicans won in the more populous Northeast and Midwest.","the Democrats won the Midwest and the South, while the Republicans won in the Northeast and West.","the Democrats won in the Northeast and West, while the Republicans won in the Northeast and South.","the Republicans swept the South, and the Democrats won in all other regions.","the Democrats won the South and West, while the Republicans won in the more populous Northeast and Midwest."
1085,"Because Bush's lead over Gore in the initial count was less than one-tenth of one percent,Florida law mandated","that the Florida state legislature vote to declare Bush the winner.","the outcome of the election be determined by the Florida Supreme Court.","the Secretary of State to certify the results.","an automatic recount.","a thirty-day extension for absentee ballots.","an automatic recount."
1086,"In Bush v. Gore (2000), the United States Supreme Court ruled that","the Florida Supreme Court did not have jurisdiction over the presidential election legal issues.","although a recount was legal, the same (or more precise) standards for evaluating ballots would have to be applied in all counties.","the butterfly ballot was unconstitutional.","the time used to recount ballots could extend past December 12, when the Florida electors would meet.","punch card ballots were illegal if not used in all counties.","although a recount was legal, the same (or more precise) standards for evaluating ballots would have to be applied in all counties."
1087,"According to exit polls, ________ was a major reason voters selected Bush in 2004.","welfare reform","health care reform","the war on terrorism","freedom of speech","strategic voting","the war on terrorism"
1088,"In the 2004 election, John Kerry won votes among those most concerned with","the economy, health care, and education.","the fairness of the tax system.","the environment, the economy, and transportation issues.","the environment and urban affairs.","civil rights, the environment, and the economy.","the economy, health care, and education."
1089,"Suffrage means","the right to vote.","turning out to vote.","voting for the winner.","voting for the loser.","the struggle for equal rights for women.","the right to vote."
1090,"Which of the following is TRUE about American elections over the past 100 years?","The suffrage has broadened, and the turnout has increased.","The suffrage has broadened, and the turnout has decreased.","The suffrage has narrowed, and the turnout has increased.","The suffrage has narrowed, and the turnout has decreased.","Suffrage has broadened, but there has been no change in turnout.","The suffrage has broadened, and the turnout has decreased."
1091,"Suffrage refers to","a type of election unique to the United States.","the right to vote.","a voter registration system.","voter turnout rates.","voting procedures in the electoral college.","the right to vote."
1092,"As the right to vote has been extended,","voter turnout has increased proportionately.","proportionately fewer of those eligible have chosen to vote.","the number of candidates running for office has increased.","voter turnout has actually remained about the same.","the scope of American government has shrunk.","proportionately fewer of those eligible have chosen to vote."
1093,"The nearly two centuries of American electoral history has been characterized by","consistently close elections.","increasing voter turnouts.","expansion of the right to vote.","a proliferation of presidential candidates.","all of the above","expansion of the right to vote."
1094,"The high point of voter turnout in the United States was in","1896.","1932.","1972.","1968.","1960.","1896."
1095,"People are more likely to vote for all of the following reasons EXCEPT if they","have a high sense of civic duty.","have a high sense of political efficacy.","are able to see policy differences that affect their interests.","believe that some policies of one party are balanced by other policies of the other party.","none of the above","believe that some policies of one party are balanced by other policies of the other party."
1096,"Anthony Downs ¹ theory of rational voting behavior predicts that people will vote if they","can afford the time and energy to do so.","think one party will give them more policy benefits than the other.","think their vote will make the difference for a particular candidate.","identify with a particular candidate, even though they doubt that one vote can make a difference.","feel obligated to do so.","think one party will give them more policy benefits than the other."
1097,"Those largely indifferent to the results of an election, but who decide to vote anyway to showsupport for democratic government are called ________ voters.","guilt-driven","civic-duty","regime-maintenance","patriotic disaffected","disaffected","civic-duty"
1098,"The greater one's sense of political efficacy, the","less likely one is to vote.","more likely one is to vote.","greater one's chance of being defeated in an election.","less likely one is to view the election process in the United States as legitimate.","more likely one is to see differences between the parties.","more likely one is to vote."
1099,"Political efficacy refers to the belief that","the costs of voting outweigh the benefits.","significant policy differences exist between the parties.","one should always support democratic government.","ordinary people can influence the government.","government is very inefficient and needs to be streamlined.","ordinary people can influence the government."
1100,"Largely to prevent corruption associated with stuffing ballot boxes, states adopted ________around the turn of the twentieth century.","the electoral college","primary elections","voting machines","voter registration","the secret ballot","voter registration"
1101,"Voter registration was begun around the turn of the twentieth century","to encourage voting through advance notice.","by party bosses to discourage people from voting.","to make elections more ethical.","to allow for the secret ballot.","to discourage patronage.","to make elections more ethical."
1101,"Voter registration was begun around the turn of the twentieth century","to encourage voting through advance notice.","by party bosses to discourage people from voting.","to make elections more ethical.","to allow for the secret ballot.","to discourage patronage.","to make elections more ethical."
1103,"Compared to other countries, the United States holds ________ elections for various offices.","far fewer","somewhat fewer","about the same number of","more","twice as many","more"
1104,"A major reason cited for America's level of voter turnout compared to other industrializedcountries is","bad weather in certain parts of the United States on election day.","greater interest in democracy in the United States.","registration is more cumbersome in the United States.","registration is more cumbersome in other nations.","Americans ¹ high sense of political efficacy.","registration is more cumbersome in the United States."
1105,"Compared to other industrialized democracies, the United States has a ________ voter turnout.","much higher","slightly higher","slightly lower","much lower","rising","much lower"
1106,"Which of the following countries has a lower voter turnout rate than the United States?","Australia","Great Britain","Switzerland","Italy","France","Switzerland"
1107,"Which of the following countries has the lowest voter turnout rate?","Australia","United States","Italy","France","Bulgaria","United States"
1108,"Voter turnout in the United States is much lower than in other countries in part because","of the unique American requirement of voter registration.","Americans are asked to vote less often and do not sustain interest in the electoral process.","Americans vote for fewer political offices and lack a sense of political efficacy.","the choice offered Americans is greater than in other countries, which confuses potential voters.","of the strident positions taken by the parties, which alienate middle-of-the-road voters.","of the unique American requirement of voter registration."
1109,"Which of the following statements is FALSE?","Unlike the United States, the governments of most democracies take the responsibility of seeing to it that all of their eligible citizens are on the voting lists.","American government asks citizens to vote far more often than most democracies.","Americans are expected to vote for a much narrower range of political offices than most democracies.","The choice offered Americans at elections is not as great as in other democracies.","none of the above","Americans are expected to vote for a much narrower range of political offices than most democracies."
1110,"Which of these would be most likely to vote?","a well-educated, middle-aged government worker","a young southerner without a high school diploma","a well-educated senior citizen who used to work for a big corporation","a young southern high school teacher","a middle-aged professor at a private university","a well-educated, middle-aged government worker"
1111,"Which of the following is INCORRECT?","Congress requires voter registration nationwide.","The Motor Voter Act allows eligible voters to register by checking a box on their driver's license application.","In North Dakota, you don ¹t have to register to vote.","In a few states, you can register to vote on election day.","Some states let you register at supermarkets.","Congress requires voter registration nationwide."
1112,"Among the states that allow voter registration at the polls on election day, voter turnout ratesare","higher than in other states.","impossible to compute.","no different than in other states.","lower than the national average.","declining over time and at a higher rate than in other states.","higher than in other states."
1113,"Approximately how many states allow voters to register at the polls on election day?","6","14","34","44","49","6"
1113,"Approximately how many states allow voters to register at the polls on election day?","6","14","34","44","49","6"
1115,"The impact of the Motor Voter Act of 1993 was evidenced in","higher registration and higher turnout in 1996 and 2000.","higher registration and lower turnout in 1996 and 2000.","no changes in either registration or turnout in 1996 and 2000.","lower registration and higher turnout in 1996 and 2000.","none of the above","higher registration and lower turnout in 1996 and 2000."
1116,"The group of people with the lowest voter turnout rate is","college graduates.","young people.","women.","senior citizens over 70.","union members.","young people."
1117,"According to the text, the most important factor affecting voter turnout is","education.","gender.","ideology.","race.","geography.","education."
1118,"Highly educated individuals are more likely to vote because","they are smarter.","they see more policy differences between candidates.","they have a lower sense of political efficacy.","most of them are white males.","they have more influence.","they see more policy differences between candidates."
1119,"Which of the following statements about voter participation is FALSE?","As people age, their likelihood of voting increases.","Minority groups with high levels of income and education have a higher turnout rate than whites with comparable status.","Men are more likely to vote than women.","Individuals who have lived at the same address longer are more likely to vote than those who have moved.","none of the above","Men are more likely to vote than women."
1120,"Which of the following characteristics would make one more likely to vote in an election?","having a college degree","being a young adult","having a low income","being a college student","bring a welfare recipient","having a college degree"
1120,"Which of the following characteristics would make one more likely to vote in an election?","having a college degree","being a young adult","having a low income","being a college student","bring a welfare recipient","having a college degree"
1122,"The mandate theory of elections","is based on the economic theory of rational decision making.","explains voters ¹ decisions according to an evaluation of the candidates ¹ personality.","says that people vote for candidates because they want them to carry out certain policies.","explains voters ¹ decisions according to party identification.","is based on the sociological theory of irrational behaviorism.","says that people vote for candidates because they want them to carry out certain policies."
1123,"The mandate theory of elections is most often cited as the proper way to view elections by","the defeated candidate.","the winning candidate.","political scientists.","everybody.","the media.","the winning candidate."
1124,"The mandate theory of elections is the idea that","a candidate must get at least sixty percent of the vote to win.","a candidate must get a majority of the votes cast (fifty percent plus one) in order to take office.","the election winner has authorization from the voters to carry out his or her promised policies.","in order to improve turnout rates in the United States, voting must be made a legal requirement of all citizens, with the failure to vote resulting in a small fine.","a candidate must get at least seventy-five percent of the vote to win.","the election winner has authorization from the voters to carry out his or her promised policies."
1125,"________ are crucial for many voters because they provide a regular perspective throughwhich voters can view the political world.","Party identifications","Civic duties","Direct primary elections","Initiative petitions","Party platforms","Party identifications"
1126,"Political scientists tend to focus on each of the following major elements of voters ¹ decisionsEXCEPT","voters ¹ party identification.","voters ¹ ideology and world view.","voters ¹ evaluation of the candidates.","the match between voters ¹ policy positions and those of the candidates and parties.","none of the above","voters ¹ ideology and world view."
1126,"Political scientists tend to focus on each of the following major elements of voters ¹ decisionsEXCEPT","voters ¹ party identification.","voters ¹ ideology and world view.","voters ¹ evaluation of the candidates.","the match between voters ¹ policy positions and those of the candidates and parties.","none of the above","voters ¹ ideology and world view."
1128,"Over the last five decades, voting based primarily on party identification has","completely disappeared.","declined sharply.","stayed almost exactly the same.","increased.","increased sharply.","declined sharply."
1128,"Over the last five decades, voting based primarily on party identification has","completely disappeared.","declined sharply.","stayed almost exactly the same.","increased.","increased sharply.","declined sharply."
1130,"Research by Rosenberg and McCafferty discovered that","a candidate's image and appearance is the most important factor in how a person votes.","less educated voters are more likely to view candidates in terms of their personal attributes.","it is possible to manipulate a candidate's appearance in a way that affects voters ¹ choices.","a candidate's image and appearance has no real impact on voting behavior.","none of the above","it is possible to manipulate a candidate's appearance in a way that affects voters ¹ choices."
1131,"Which of these is the least important dimension of a candidate's image?","intelligence","integrity","reliability","competence","experience","intelligence"
1132,"________ occurs when people base their choices in an election on their own issue preferences.","Civic duty","Suffrage","Retrospective voting","Policy voting","Agenda setting","Policy voting"
1133,"A voter supporting a candidate based specifically on comparing the candidate's stances on theissues of abortion rights, health care, and government aid to education to the voter's ownpreferences on such issues is an example of","retrospective voting.","policy voting.","civic duty.","initiative.","agenda setting.","policy voting."
1134,"Research has found that those most likely to view the candidates in terms of their personalattributes are","minority voters.","college-educated voters.","low-income voters.","women voters.","non-voters.","college-educated voters."
1135,"Which of the following is TRUE about the electoral college?","On very rare occasions, an elector has voted differently from the popular vote winner of his state.","It is scheduled to be phased out in 2006, though some still argue its usefulness and want to rescind the phase-out.","It is used in nearly half of the democratic nations around the world.","An elector has never voted differently from the popular vote winner of his state.","none of the above","On very rare occasions, an elector has voted differently from the popular vote winner of his state."
1135,"Which of the following is TRUE about the electoral college?","On very rare occasions, an elector has voted differently from the popular vote winner of his state.","It is scheduled to be phased out in 2006, though some still argue its usefulness and want to rescind the phase-out.","It is used in nearly half of the democratic nations around the world.","An elector has never voted differently from the popular vote winner of his state.","none of the above","On very rare occasions, an elector has voted differently from the popular vote winner of his state."
1135,"Which of the following is TRUE about the electoral college?","On very rare occasions, an elector has voted differently from the popular vote winner of his state.","It is scheduled to be phased out in 2006, though some still argue its usefulness and want to rescind the phase-out.","It is used in nearly half of the democratic nations around the world.","An elector has never voted differently from the popular vote winner of his state.","none of the above","On very rare occasions, an elector has voted differently from the popular vote winner of his state."
1138,"As provided in the Constitution, how are electoral votes allocated for each state?","Each state has as many electoral votes as it has members in the House of Representatives.","Each state has as many electoral votes as it has members in both the House and the Senate.","Each state has as many electoral votes as it has members in the Senate.","Each state is proportioned to their population, with all states having at least one vote.","Each state casts two electoral votes.","Each state has as many electoral votes as it has members in the Senate."
1138,"As provided in the Constitution, how are electoral votes allocated for each state?","Each state has as many electoral votes as it has members in the House of Representatives.","Each state has as many electoral votes as it has members in both the House and the Senate.","Each state has as many electoral votes as it has members in the Senate.","Each state is proportioned to their population, with all states having at least one vote.","Each state casts two electoral votes.","Each state has as many electoral votes as it has members in the Senate."
1140,"If no candidate receives an electoral college majority,","a runoff election is held nationwide between the top two vote-getters.","the candidate with the plurality of electoral votes is automatically elected.","the House of Representatives chooses among the top three electoral vote winners.","the electoral college takes a second ballot between the top two vote -getters, and the candidate who wins the majority is elected.","Congress is free to elect the president.","the House of Representatives chooses among the top three electoral vote winners."
1140,"If no candidate receives an electoral college majority,","a runoff election is held nationwide between the top two vote-getters.","the candidate with the plurality of electoral votes is automatically elected.","the House of Representatives chooses among the top three electoral vote winners.","the electoral college takes a second ballot between the top two vote -getters, and the candidate who wins the majority is elected.","Congress is free to elect the president.","the House of Representatives chooses among the top three electoral vote winners."
1142,"Except in Maine and Nebraska, the electoral college system operates in each state on theprinciple of allocating electoral votes on the basis of","winner-take-all.","proportional representation.","allocating electoral votes based on the winner in each congressional district.","a mixture of winner-take-all and proportional representation.","majority rule.","winner-take-all."
1143,"Which of the following statements about the electoral college is FALSE? w","Each state has as many electoral votes as it has United States senators and representatives.","Every state has a winner-take-all system where electors vote as a bloc for the winner.","Electors meet in their states in December and mail their votes to the vice president.","If no candidate receives an electoral majority, then the election is thrown into the House of Representatives.","Some states have a winner take all system where electors vote as a bloc for the winner.","Every state has a winner-take-all system where electors vote as a bloc for the winner."
1144,"If a presidential candidate does not receive a majority of electoral college votes, then thepresident is chosen","by popular vote.","by the Justices of the Supreme Court.","by the House with one vote for each state.","by the Senate with two votes for each state.","by majority vote of the entire Congress in a joint session.","by the House with one vote for each state."
1145,"Research on voting behavior has shown that","policy voting has become somewhat easier than in the past.","a candidate's image is not as important today as it was in the past.","Americans tend to identify with the underdog.","party identification has become more important in voting decisions.","policy voting has become harder than in the past.","policy voting has become somewhat easier than in the past."
1145,"Research on voting behavior has shown that","policy voting has become somewhat easier than in the past.","a candidate's image is not as important today as it was in the past.","Americans tend to identify with the underdog.","party identification has become more important in voting decisions.","policy voting has become harder than in the past.","policy voting has become somewhat easier than in the past."
1147,"Which is FALSE regarding the electoral college?","Whoever wins the most votes in the electoral college wins, even if that isn ¹t a majority.","Maine and Nebraska do not use the   winner-take-all   system.","Electors can vote for whomever they want, regardless of how their state's voters voted.","In most states ALL the electors vote for whomever won the most votes in their state, even if that wasn ¹t a majority.","The electors themselves are selected by state parties.","Whoever wins the most votes in the electoral college wins, even if that isn ¹t a majority."
1148,"The greater the policy differences between the candidates,","the closer the election.","the more likely voters will be able to steer government policies by their choices.","the lower the turnout in the general election.","the more likely voters will make choices based on personality traits.","the higher the voter turnout in the election.","the more likely voters will be able to steer government policies by their choices."
1149,"In ________, incumbents who provide desired results are rewarded; those who fail to do so arepunished.","indirect primaries","initiatives","referendums","retrospective voting","incentive voting","retrospective voting"
1150,"If engaged in retrospective voting, an individual would ask:","What have you done for me lately?","Who will do more for me next year?","Who is the more attractive candidate?","Why should I vote at all?","Who will be lowering taxes?","What have you done for me lately?"
1151,"When President Herbert Hoover and the Republicans were crushed in the election of 1932,voters were responding to the severity of the Great Depression under Hoover's presidency by","retrospective voting.","indirect primary voting.","direct primary voting.","initiative.","irrational choice voting.","retrospective voting."
1151,"When President Herbert Hoover and the Republicans were crushed in the election of 1932,voters were responding to the severity of the Great Depression under Hoover's presidency by","retrospective voting.","indirect primary voting.","direct primary voting.","initiative.","irrational choice voting.","retrospective voting."
