ID, question, Option 1, Option 2, Option 3, Option 4, Option 5, Answer
1640,"Until the late-nineteenth century, most government employees got their jobs through","the patronage system.","the merit principle.","hereditary preferences.","civil service testing.","a lottery system.","the patronage system."
1641,"The ________ Act was passed partly as a memorial to the memory of President James Garfield,who was assassinated in 1881.","Pendleton Civil Service","Treason","Voting Rights","Hatch","Interstate Commerce","Pendleton Civil Service"
1642,"The Pendleton Act established the","patronage system.","federal civil service.","Office of Management and Budget.","plum book.","Interstate Commerce Commission.","federal civil service."
1643,"The rationale for all civil service systems is based on","patronage.","the merit principle.","the Hatch Act.","the plum book.","voluntary service.","the merit principle."
1644,"The Hatch Act, passed in 1940,","established the patronage system for federal employment.","prohibited the president from firing the heads of independent executive agencies.","prohibits federal civil service employees from active participation in partisan politics.","required the publication of the plum book.","established the federal civil service.","prohibits federal civil service employees from active participation in partisan politics."
1645,"Once hired into the federal bureaucracy, a person is assigned a ________ rating, whichdetermines one's salary range.","Federal Register","Weber","General Schedule","step ladder","plum book","General Schedule"
1646,"The federal civil service was created by","Article IV of the Constitution.","an executive order of President Arthur.","the Office of Management and Budget.","the merit principle.","the Pendleton Act.","the Pendleton Act."
1647,"The rationale for the civil service rests on the","goal of centralizing government employment at the federal level.","desire to create a nonpartisan government service and promotion on the basis of merit.","General Schedule rating system for patronage appointees.","the need to separate military institutions from civilian institutions to prevent undue military influence.","need for job replacements when a new party comes to power.","desire to create a nonpartisan government service and promotion on the basis of merit."
1648,"Federal employees are prohibited from active participation in partisan politics through the","Twenty-fifth Amendment.","Pendleton Act.","Supreme Court ruling in Democratic National Committee v. Hayes.","Hatch Act.","merit system.","Hatch Act."
1649,"Which of the following is a legitimate criticism of the federal civil service?","Firing incompetents is extremely difficult.","Workers are not protected against political firings.","It does not operate on the merit principle.","Too many federal civil servants are actively involved in partisan politics.","all of the above","Firing incompetents is extremely difficult."
1650,"Which of the following would be included in a plum book?","doctors at a Veteran's Administration hospital","postal carriers","the phone numbers of a Congress member's sex partners","Senate committee chairs","Cabinet secretaries","Cabinet secretaries"
1651,"Which of the following statements about the hiring and firing of civil servants is FALSE?","The Office of Personnel Management has elaborate rules about hiring, promotion, and firing of civil servants.","The top of the civil service is composed of about 9,000 members of the Senior Executive Service.","Once hired, civil servants are assigned a General Schedule ranging from GS-1 to GS-18.","Due to the merit system, it is easy to fire incompetent civil servants.","none of the above","Due to the merit system, it is easy to fire incompetent civil servants."
1652,"The plum book lists","all federal contracts available for bid.","top federal jobs available by Presidential appointment.","all civil service jobs above GS-12.","job openings in the prestigious Office of Personnel Management.","appeals filed with the Merit Systems Protection Board.","top federal jobs available by Presidential appointment."
1653,"Which of the following statements about plum book appointees is FALSE?","Most presidents seek appointees with sympathy for similar policy positions.","Ambassadorship appointments often go to large campaign contributors.","Plum book appointees are often instrumental in changing and reforming their agencies.","Presidents often consider sex, region, and race in making plum book appointments.","none of the above","Plum book appointees are often instrumental in changing and reforming their agencies."
1654,"Which of the following is NOT true about presidential appointees to bureaucracies?","They often do not know their own agency subordinates very well, much less people in other agencies.","They must be recommended by the Office of Personnel Management's   rule of three.","As political appointees, they are often unaccustomed to the administrative routines, budget cycles, and legal complexities of their agencies or departments.","They tend to spend fewer years in their positions than those in the civil service.","none of the above","They must be recommended by the Office of Personnel Management's   rule of three."
1655,"According to Hugh Heclo, the plum book system of recruiting federal employees tends toresult in the appointment of","talented experts with proven party loyalty.","people with access to the Internet, but not necessarily the most qualified people.","senior civil servants to sensitive posts.","administrators who do not stay long enough in their appointed position to be effective.","large numbers of women and minorities, just as it was intended to do.","administrators who do not stay long enough in their appointed position to be effective."
1656,"Which Cabinet department is charged with overseeing the nation's national resources?","Homeland Security","Environmental Protection Agency","Defense","State","Interior","Interior"
1657,"The real work of a Cabinet department is done","by the entire Cabinet.","by the president's staff.","by the undersecretaries.","by the secretary.","in the bureaus.","in the bureaus."
1658,"The largest federal agency based on dollars spent is the","Department of Defense.","Department of Justice.","State Department.","Department of Health and Human Services.","Social Security Administration.","Social Security Administration."
1659,"Which of these is the newest government agency?","Drug Enforcement Agency","Social Security Administration","Department of Health and Human Services","Drug Interdiction Agency","Cyberspace Commission","Social Security Administration"
1660,"The Cabinet department that has the largest budget is the Department of","Health and Human Services.","Defense.","Commerce.","the Treasury.","Education.","Health and Human Services."
1661,"Bureaus in the federal bureaucracy are also known as all of the following EXCEPT","an administration.","an office.","a department.","a service.","none of the above","a department."
1662,"The Interstate Commerce Commission and the Federal Reserve Board are examples of","dependent presidential boards.","independent regulatory agencies.","government corporations.","Cabinet departments.","independent executive agencies.","independent regulatory agencies."
1663,"Which of the following statements about independent regulatory commissions is FALSE?","Regulatory commission members cannot be fired by the president.","Regulatory commissions consist of five to ten members.","Regulatory commission members are appointed by the president and confirmed by the Senate.","Regulatory commission members may not be drawn from the ranks of present or former employees of the regulated industry.","none of the above","Regulatory commission members may not be drawn from the ranks of present or former employees of the regulated industry."
1663,"Which of the following statements about independent regulatory commissions is FALSE?","Regulatory commission members cannot be fired by the president.","Regulatory commissions consist of five to ten members.","Regulatory commission members are appointed by the president and confirmed by the Senate.","Regulatory commission members may not be drawn from the ranks of present or former employees of the regulated industry.","none of the above","Regulatory commission members may not be drawn from the ranks of present or former employees of the regulated industry."
1665,"The parts of the federal bureaucracy with responsibility for different sectors of the economy,and making and enforcing rules designed to protect the public interest, are the","independent executive agencies.","independent regulatory agencies.","commercial ministries.","government corporations.","Cabinet departments.","independent regulatory agencies."
1666,"The General Services Administration and the National Aeronautical and Space Administrationare examples of","government corporations.","independent regulatory agencies.","Cabinet departments.","presidential administrative agencies.","independent executive agencies.","independent executive agencies."
1667,"Independent regulatory agencies have","complete independence from the president, but their policymakers are appointed by Congress.","powerful rule-making, dispute-settling, and enforcement authority.","no real enforcement power any more, and remain today as part of the federal government only in a ceremonial role.","no formal ties to either the president or the Congress.","governing commissions composed of long-time federal Civil Service employees.","powerful rule-making, dispute-settling, and enforcement authority."
1668,"Amtrak and the United States Postal Service are examples of","government corporations.","independent executive agencies.","Cabinet departments.","executive commercial agencies.","independent regulatory agencies.","government corporations."
1669,"Government corporations","operate an airline, manufacture steel, and provide health insurance.","provide services and charge for them.","tend to be captured by interest groups.","are independent regulatory agencies.","sell stock and pay dividends.","provide services and charge for them."
1670,"An obstacle to the successful implementation of public policy is","the failure of Congress to pass authorizing legislation.","the over-specialization of civil service employees.","competition between the private and public sectors.","unclear policy goals and poorly designed policies.","all of the above","unclear policy goals and poorly designed policies."
1671,"Once a policy decision has been made, such as by passing a legislative act or issuing anexecutive order, the bureaucracy is responsible for","its ratification.","its implementation.","its deregulation.","funding it.","judging its merits.","its implementation."
1672,"The main job of federal bureaucrats is to","advise the president and Cabinet on internal affairs.","countervail the power of private corporations, especially monopolies.","compete with the private sector for monopoly power.","protect the interests of their constituencies.","implement and regulate government policies.","implement and regulate government policies."
1673,"Creating new agencies, developing guidelines, and coordinating resources to achieve a policygoal is called","bureaucratization.","regulation.","implementation.","actualization.","policymaking.","implementation."
1674,"Which of the following is NOT a reason that policy implementation sometimes breaks down inthe federal bureaucracy?","fragmentation of responsibilities","lack of standard operating procedures","lack of clarity in the original policy decision","faulty program design","lack of resources","lack of standard operating procedures"
1675,"Vigorous disputes over the implementation of Title IX of the Education Amendments of 1972in regard to funding for women's athletic programs arose primarily due to","faulty program design.","lack of clarity in the original policy decision.","adherence to administrative routine.","fragmentation of responsibilities.","all of the above","lack of clarity in the original policy decision."
1676,"Section 844 of Title IX of the Education Amendments of 1972","was declared unconstitutional by the Supreme Court.","specifically prohibits sex discrimination in college sports.","was supported by most colleges and universities.","was vaguely written, eventually resulting in scores of court cases.","was interpreted by Congress to exclude college football.","was vaguely written, eventually resulting in scores of court cases."
1677,"A major complaint of the Food and Drug Administration is","its lack of clarity.","the fragmentation of responsibilities.","that there is no administrative discretion.","that too much food is contaminated by dirt and rodents.","the shortage of personnel.","the shortage of personnel."
1678,"Which of the following is NOT true about standard operating procedures?","They provide routine rules to help bureaucrats make numerous everyday decisions.","Each federal department and agency has a plum book which lists its standard operating procedures.","They can sometimes be so routinized that they are difficult to change even in the face of changing circumstances.","They are referred to as   red tape   by those who find them burdensome.","They are used by street-level bureaucrats.","Each federal department and agency has a plum book which lists its standard operating procedures."
1679,"Standard operating procedures","usually prove to be unjust and discriminatory when followed to the letter.","save time and bring uniformity to complex organizations.","were waived by the Reagan Administration in an effort to make the bureaucracy more flexible and customize the solutions to problems.","give authority to administrative actors to select among various responses to a given problem.","are frustrating and inappropriate in addressing most situations.","save time and bring uniformity to complex organizations."
1680,"Standard operating procedures accomplish all of the following EXCEPT","bring uniformity to complex organizations.","save time.","make personnel interchangeable.","reduce red tape.","treat citizens equally, regardless of class or race.","reduce red tape."
1681,"________ is the authority of administrative actors to select among various responses to a givenproblem.","Standard operating procedure","Administrative discretion","Administrators ¹ disposition","Executive power","Deregulation","Administrative discretion"
1682,"Standard operating procedures become frustrating to citizens and obstacles to action whenthey","do not directly apply to a particular situation.","slow bureaucratic responses to citizens ¹ needs.","are not specifically codified.","transfer personnel to different posts.","are not closely followed.","do not directly apply to a particular situation."
1683,"The authority of administrative actors to select among various responses to a given problem iscalled","policy implementation.","selective management.","the merit principle.","the definition of alternatives.","administrative discretion.","administrative discretion."
1684,"Administrative discretion is greatest when","rules and regulations are not written down.","when standard operating procedures are used.","an agency has elaborate rules and regulations.","a particular agency is the subject of media coverage.","rules do not fit a case.","rules do not fit a case."
1685,"The Federal Aviation Administration's protocol for for hijackings assumed that","the pilot would be able to radio air traffic controllers and alert them to the problem.","the FAA would be able to pinpoint the aircraft involved.","there would be enough time for the government to formulate a response.","the hijackers would be motivated in part by a desire to stay alive.","All of the above","All of the above"
1686,"Those civil service employees who are in constant contact with the public (often a hostile one)and have considerable discretion are known as","street-level bureaucrats.","routinizers.","General Schedule foot soldiers.","the Senior Executive Service.","civil servants.","street-level bureaucrats."
1687,"Administrative personnel who exercise discretion, pay attention to routine, and deal directlywith clients,","are called street-level bureaucrats.","are limited to high-level positions in the administration.","implement federal policies.","are part of the Senior Executive Service.","are usually dismissed for not following standard operating procedures.","are called street-level bureaucrats."
1688,"Which of the following would not be considered a street-level bureaucrat?","a municipal court judge","an assistant secretary in the Department of Transportation","a welfare worker","a mail carrier who delivers mail exclusively in a high-rise building","a police officer","an assistant secretary in the Department of Transportation"
1689,"When bureaucrats are asked to execute orders with which they do not agree,","they usually ignore the orders.","they are likely to lose their jobs if they do not follow through with the orders.","they can file a Conflict Of Interest Form and will be exempted from that duty by their boss.","implementation follows standard operating procedures.","slippage is likely to occur between policy decisions and performance.","slippage is likely to occur between policy decisions and performance."
1690,"Which of the following statements is FALSE?","Bureaucrats are often fired for using too much administrative discretion.","Pay raises in the bureaucracy tend to be small and across -the-board.","Removing appointed officials may be politically embarrassing to the president.","A government agency cannot expand just because it is performing a service effectively and efficiently.","none of the above","Bureaucrats are often fired for using too much administrative discretion."
1691,"The diffusion of responsibility within the bureaucracy","makes the coordination of policies both time-consuming and difficult.","increases administrative discretion.","allows for a diversity of opinion thus facilitating effective administration.","helps diminish the use of administrative discretion.","facilitates the use of inter-bureaucracy standard operating procedures.","makes the coordination of policies both time-consuming and difficult."
1692,"Proposals to reorganize the government in order to solve the problem of bureaucraticfragmentation","are often opposed by agencies not wanting to be submerged within a broader bureaucratic unit.","tend to be supported by Republican presidents, who advocate governmental centralization.","are opposed by congressional committees, fearing they will be given greater responsibility to oversee larger and more diverse agencies.","are supported by interest groups, who feel they could better control the regulatory programs of a reorganized bureaucracy.","are supported and opposed for all of these reasons.","are often opposed by agencies not wanting to be submerged within a broader bureaucratic unit."
1693,"The Voting Rights Act of 1965","was very difficult to implement because of the fragmentation of responsibility for implementing it.","was successfully implemented thanks to its clear goal, its clear methods to achieve the goal, and its lack of bureaucratic fragmentation.","failed to achieve its policy goals because of the outright hostility of street -level bureaucrats.","was impossible to implement because of a lack of clarity in the legislation.","All but D are true.","was successfully implemented thanks to its clear goal, its clear methods to achieve the goal, and its lack of bureaucratic fragmentation."
1694,"The Voting Rights Act of 1965 was successful for all of the following reasons EXCEPT","its goal was clear.","its implementation was straightforward.","the authority of the implementors was plain.","it was universally supported.","none of the above","it was universally supported."
1695,"The use of government authority to control or change some practice in the private sector isknown as","socialism.","regulation.","oversight.","executive review.","public administration.","regulation."
1696,"The use of governmental authority to control or change some practice in the private sector iscalled","regulation.","patronage.","administrative discretion.","policy implementation.","public administration.","regulation."
1697,"Which of the following statements about government regulation in America is accurate?","The Constitution set up only six regulatory agencies; the others have been created within the past 100 years or so.","The Federal Communications Commission was the first independent regulatory agency.","Until 1887, the federal government made almost no regulatory policies and had no regulatory agencies.","Regulatory agencies tended to be more popular in the early years of the nation's history, then grew more controversial during the late-nineteenth century.","both A and C","Until 1887, the federal government made almost no regulatory policies and had no regulatory agencies."
1698,"In the case of Munn v. Illinois, decided in 1877, the United States Supreme Court","ruled that states could not impose corporate income taxes.","ruled that the Civil Service System was constitutional.","outlawed the patronage system.","held that government had no right to regulate the business operations of a firm.","upheld the right of government to regulate the business operations of a firm.","upheld the right of government to regulate the business operations of a firm."
1699,"Until 1887, the federal government","had almost no regulatory policies.","was involved only in social regulation.","owned and operated most of the major industries in the country.","forbade the states from passing regulatory policies.","was involved only in economic regulation.","had almost no regulatory policies."
1700,"The Supreme Court case of Munn v. Illinois (1877)","declared that regulation was not within the realm of state powers.","first established the right to own property as one of the rights of the Bill of Rights.","set the precedent for deregulation.","upheld the right of government to regulate the business operations of a firm.","upheld the constitutionality of the Interstate Commerce Commission.","upheld the right of government to regulate the business operations of a firm."
1701,"Most regulatory agencies adopt specific ________ to carry out a policy, based on what theybelieve was the intended purpose of the specific policy at hand.","guidelines","iron triangles","incentive systems","mandates","merit principles","guidelines"
1702,"Whatever strategy Congress permits a regulatory agency to use, all regulation contains thefollowing elements EXCEPT","some means of enforcing compliance.","a grant of power and set of directions from Congress.","a set of rules and guidelines by the regulatory agency itself.","an incentive system to maximize performance by those regulated.","none of the above","an incentive system to maximize performance by those regulated."
1703,"All regulations contain each of the following elements EXCEPT","a grant of power and set of directions from Congress","some means of enforcing compliance with congressional goals and agency regulations","presidential oversight and control of enforcement","a set of rules and guidelines by the regulatory agency itself","All of these are elements of the regulatory process.","presidential oversight and control of enforcement"
1704,"When Congress passes regulatory legislation for which it has established goals, it then","grants power to regulatory agencies to develop guidelines and enforce compliance.","assigns responsibility for administration to regulatory agencies and responsibility for enforcement to the courts.","establishes the guidelines that regulatory agencies must implement.","grants interest groups the power to develop the rules governing the new policy.","authorizes the president to use his administrative discretion to implement the legislation.","grants power to regulatory agencies to develop guidelines and enforce compliance."
1705,"One proposed solution to the   problem   of the proliferation of regulatory agencies and policieshas been","deregulation.","deproliferation.","budget cuts.","standard operating procedures.","the incentive system.","deregulation."
1706,"Deregulation has resulted, at least in part, in each of the following EXCEPT","environmental damage.","the proliferation of government agencies.","competitive airline fares.","an expensive bailout of the savings and loan industry.","less government oversight in some key areas.","the proliferation of government agencies."
1707,"Which of the following is NOT an accusation made against the regulatory system?","Excessive regulation contributed to the savings and loan industry disaster of the 1980s.","If the producer is faced with expensive regulations, costs will inevitably be passed along to the consumer in the form of higher prices.","Regulations do not always work well, and they simply create massive regulatory bureaucracies.","Other nations have laxer regulations on pollution, worker safety, and other business practices, thus American exports often cost more.","All of these have been criticisms of regulation.","Excessive regulation contributed to the savings and loan industry disaster of the 1980s."
1708,"Each of the following is a criticism of regulation EXCEPT that it","lowers prices.","does not work.","distorts market forces.","is too complex.","gives bureaucrats too much power.","lowers prices."
1709,"Most of the government is composed of","regulators.","lawyers.","bureaucrats.","elected legislators.","politicians.","bureaucrats."
1710,"Executive orders are issued by","independent regulatory agencies.","any federal agency or department.","Congress.","members of the Senior Executive Service.","the president.","the president."
