ID, question, Option 1, Option 2, Option 3, Option 4, Option 5, Answer
549,"Which of the following statements about the immediate consequence of women receiving theright to vote is FALSE?","Many supporters of the right to vote accepted the traditional model of the family.","The feminist movement gained steam immediately after the right to vote was secured.","Winning the right to vote did not automatically give women equal rights, pay, and status.","Many state laws continued to enshrine the traditional view of the family in public policy.","Gaining the right to vote did not eliminate many of the challenges facing women.","The feminist movement gained steam immediately after the right to vote was secured."
550,"After passage of the Nineteenth Amendment in 1920, public policy toward women wasdominated by","protectionism.","the principle of equality.","coverture.","matriarchalism.","economic, but not political, advances.","protectionism."
551,"The feminist movement was reborn","when women became involved in the war effort during World War II.","when the Supreme Court made its decision in Roe v. Wade.","after the Civil War when women became inspired by the emancipation of the slaves.","during the Civil Rights movement of the 1950s and 1960s.","when the Equal Rights Amendment was first introduced in the 1920s.","during the Civil Rights movement of the 1950s and 1960s."
552,"Betty Friedan's book, ________, published in 1963, encouraged many women to questiontraditional assumptions and to assert their rights.","A Handmaid's Tale","The Second Sex","The Female Eunuch","Women and Economics","The Feminine Mystique","The Feminine Mystique"
553,"In ________, the Supreme Court ruled that any   arbitrary   sex -based classification violated theequal protection clause.","Regents of the University of California v. Bakke","Dred Scott v. Sandford","Swann v. Charlotte-Mecklenberg County Schools","Reed v. Reed","Roe v. Wade","Reed v. Reed"
554,"In the case of Craig v. Boren, the Supreme Court ruled that","sex classifications would be treated by the Court as inherently suspect.","racial classifications were constitutional if they have a compelling, legitimate, and rational purpose.","it would employ a   medium scrutiny   standard: sex discrimination would be treated as neither valid nor invalid.","sex classifications would be treated by the Court as valid.","all sex classifications were unconstitutional.","it would employ a   medium scrutiny   standard: sex discrimination would be treated as neither valid nor invalid."
554,"In the case of Craig v. Boren, the Supreme Court ruled that","sex classifications would be treated by the Court as inherently suspect.","racial classifications were constitutional if they have a compelling, legitimate, and rational purpose.","it would employ a   medium scrutiny   standard: sex discrimination would be treated as neither valid nor invalid.","sex classifications would be treated by the Court as valid.","all sex classifications were unconstitutional.","it would employ a   medium scrutiny   standard: sex discrimination would be treated as neither valid nor invalid."
556,"The Supreme Court has voided each of the following sexual discrimination laws EXCEPT lawsthat","provided for alimony payments to women only.","made statutory rape a crime for men only.","set a higher age for drinking for men than for women.","closed a state's nursing school to men.","provided child support for women only.","made statutory rape a crime for men only."
557,"Which of the following is TRUE?","Many sex discrimination cases have involved men seeking equality with women.","The Supreme Court first struck down a law on the basis of sex discrimination in 1920.","The Supreme Court has so far struck down only a handful of laws for discriminating on the basis of gender.","All of these are true.","None of these are true.","Many sex discrimination cases have involved men seeking equality with women."
558,"The Equal Rights Amendment failed because","it was vetoed by the President.","the Supreme Court voided it as unconstitutional.","it did not win the required two-thirds vote in each chamber of Congress.","it was rejected by the United States Senate.","it fell three states short of sufficient ratification.","it fell three states short of sufficient ratification."
559,"The ________ banned gender discrimination in employment by law.","Civil Rights Act of 1964","Fair Labor Standards Act","Supreme Court ruling in National Organization for Women v. Bank of America","Nineteenth Amendment","Gender Equity Act of 1972","Civil Rights Act of 1964"
559,"The ________ banned gender discrimination in employment by law.","Civil Rights Act of 1964","Fair Labor Standards Act","Supreme Court ruling in National Organization for Women v. Bank of America","Nineteenth Amendment","Gender Equity Act of 1972","Civil Rights Act of 1964"
561,"Which of the following statements about the Equal Rights Amendment (ERA) is FALSE?","The ERA was ratified in 1982.","The ERA battle stimulated vigorous feminist activity.","The ERA battle stimulated vigorous anti-feminist activity.","The ERA was first introduced in the 1920s.","Congress passed the ERA in 1972.","The ERA was ratified in 1982."
562,"The United States Supreme Court has handed down each of the following decisionsconcerning gender discrimination in employment and business activity EXCEPT","requiring the federal government to give women equal pay for jobs of comparable worth.","prohibiting gender discrimination in private business and service clubs.","voiding laws and rules barring women from jobs through arbitrary height and weight requirements.","protecting women from being required to take mandatory pregnancy leaves from their jobs.","None of the above; the court has handed down each of the decisions above.","requiring the federal government to give women equal pay for jobs of comparable worth."
563,"The issue of ________ deals with women seeking to redress the fact that jobs traditionally heldby men tend to pay far greater salaries than jobs requiring similar skills but are traditionallyheld by women.","gender equality","affirmative action","feminized wage scales","comparable worth","the lace purse","comparable worth"
564,"Comparable worth   refers to the issue of","paying men and women equivalent salaries for jobs requiring similar skills.","government subsidization of women who choose to work at home.","the inherent dignity and equality of women with men.","reduced work responsibilities for women workers with children.","equal voting rights and access to public office for women.","paying men and women equivalent salaries for jobs requiring similar skills."
565,"Which of the following is TRUE?","Women are prohibited from serving as combat pilots.","Women are prohibited on navy warships.","Women are now allowed in ground combat units.","Both men and women must register for the draft at age 18.","none of the above","none of the above"
566,"Which of the following statements about women in the military is FALSE?","Congress has opened all the service academies to women.","Women, as well as men, are now required to register for the draft.","Statutes and regulations prohibit women from serving in most combat situations.","Women have served in every branch of the armed services since World War II.","Women do not have a ceiling on the rank they can achieve.","Women, as well as men, are now required to register for the draft."
567,"The Persian Gulf War showed that","women could serve as combat pilots.","women would not volunteer for combat positions.","there is no place in the military for women.","women did well in the military, but should not serve in combat positions.","women's military performance was inferior to men's.","women could serve as combat pilots."
568,"In 1993, the Supreme Court ruled that sexual harassment is sex discrimination that violates theCivil Rights Act when","the target objects a second time to touching, body language, or dirty talk.","it causes severe psychological injury.","the workplace environment becomes hostile or abusive.","an employee can no longer perform his or her job.","the target suffers a nervous breakdown.","the workplace environment becomes hostile or abusive."
569,"In Faragher v. City of Boca Raton (1998), the Supreme Court held that","school districts can be held liable for sexual harassment.","the military can not be responsible for sexual harassment at conferences.","employers are responsible for preventing and eliminating sexual harassment.","government entities are not responsible for preventing sexual harassment.","none of the above","employers are responsible for preventing and eliminating sexual harassment."
569,"In Faragher v. City of Boca Raton (1998), the Supreme Court held that","school districts can be held liable for sexual harassment.","the military can not be responsible for sexual harassment at conferences.","employers are responsible for preventing and eliminating sexual harassment.","government entities are not responsible for preventing sexual harassment.","none of the above","employers are responsible for preventing and eliminating sexual harassment."
571,"The 1991 convention of the Tailhook Association convention brought attention to the problemof","the failure of the Equal Rights Amendment.","homosexual activity in the armed services.","comparable worth.","sexual harassment.","sexual discrimination in the courts.","sexual harassment."
572,"The   gray liberation   movement refers to","elderly homosexuals seeking equality.","those seeking laws that break down racial barriers and promote harmony.","anti-pollution activists who seek to reduce smog.","those fighting for the rights of the elderly.","those fighting for equal rights and justice for the disabled.","those fighting for the rights of the elderly."
573,"The fastest growing age group in the American population is","Generation X.","people in their 80s.","infants.","teenagers.","baby-boomers.","people in their 80s."
574,"Age discrimination laws have","allowed children between the ages of 12 and 18 to leave their parents.","lowered the minimum compulsory retirement age to 55.","required employers to hire a certain percentage of people over the age of 50.","denied federal funds to any institution discriminating against people over forty.","all of the above","denied federal funds to any institution discriminating against people over forty."
575,"In 1990, Congress enacted the ________, a far-reaching law to protect a particular group ofAmericans from discrimination, ignoring those who claimed the price tag would be too high.","Gay and Lesbian Civil Rights Bill","Native-Americans Inclusion Act","Americans with Disabilities Act","Children's Rights Act","Immigrant Grant Act","Americans with Disabilities Act"
576,"The Rehabilitation Act of 1973","entitles all children to a free public education appropriate to their needs.","increased the amount of financial aid to disabled people.","guaranteed free, lifetime medical care and physical therapy for Vietnam War veterans.","added handicapped people to the list of Americans protected from discrimination.","prohibits employment discrimination against the disabled.","added handicapped people to the list of Americans protected from discrimination."
577,"The Americans with Disabilities Act of 1990","required all governmental buildings to have wheelchair-accessible entrances and facilities.","added AIDS victims to the list of handicapped persons.","prohibited employment discrimination against the disabled.","added handicapped people to the list of Americans protected from discrimination.","required an affirmative action program for the disabled.","prohibited employment discrimination against the disabled."
578,"Opposition to Civil Rights laws for the handicapped has been justified primarily on the basisof the","inability of disabled persons to handle most employment requirements.","fear that laws will lead to a quota system to hire disabled persons.","high cost of programs to help the disabled.","fear that the disabled will take jobs away from able-bodied persons.","all of the above","high cost of programs to help the disabled."
579,"Homophobia refers to","fear and hatred toward gay men and lesbian women.","the tendency to be sexually attracted to members of one's own sex.","the development of positive stereotypes concerning gay men and lesbian women.","promoting the Civil Rights of gay men and lesbian women.","an attitude of tolerance and acceptance toward gay men and lesbian women.","fear and hatred toward gay men and lesbian women."
580,"Affirmative action seeks to move beyond","equal results to equal opportunity.","equal opportunity to equal results.","equal opportunity to equal rights.","equal rights to equal opportunity.","negativism to positivism in human relations.","equal opportunity to equal results."
581,"The public policy paths for women and minorities converged in the debate about","affirmative action.","the Equal Rights Amendment.","military service.","gay rights.","comparable worth.","affirmative action."
582,"The goal of affirmative action is to move toward","equal facilities.","equal opportunity.","equal results.","equal pay.","comparable worth.","equal results."
583,"The strongest and most controversial form of affirmative action is","busing.","comparable worth.","numerical quotas.","comparative worth.","equal opportunity.","numerical quotas."
584,"The Supreme Court ruled against some of the basic principles of affirmative action in which ofthe following cases?","Metro Broadcasting Inc. v. Federal Communications Commission","Fullilove v. Klutznick","Regents of the University of California v. Bakke","United Steelworkers of America, AFL-CIO v. Weber","all of the above","Regents of the University of California v. Bakke"
585,"Which of the following statements about affirmative action is FALSE?","The constitutional status of affirmative action has not been very clear.","Affirmative action puts an emphasis on equal results and not merely equal opportunities.","Affirmative action has been used to establish special provisions to ensure that a portion of school admissions go to minorities and women.","Polling data shows that most Americans support affirmative action.","none of the above","Polling data shows that most Americans support affirmative action."
586,"The case of Regents of the University of California v. Bakke dealt with","affirmative action.","sexual harassment.","the right to establish a gay student organization.","comparable worth.","paid maternity leave.","affirmative action."
586,"The case of Regents of the University of California v. Bakke dealt with","affirmative action.","sexual harassment.","the right to establish a gay student organization.","comparable worth.","paid maternity leave.","affirmative action."
588,"In the case of ________, the Supreme Court ruled that affirmative action programs were notunconstitutional, but they could not involve a set-aside quota of spots available only tomembers of particular groups.","Craig v. Boren","Korematsu v. United States","Regents of the University of California v. Bakke","Reed v. Reed","Roe v. Wade","Regents of the University of California v. Bakke"
588,"In the case of ________, the Supreme Court ruled that affirmative action programs were notunconstitutional, but they could not involve a set-aside quota of spots available only tomembers of particular groups.","Craig v. Boren","Korematsu v. United States","Regents of the University of California v. Bakke","Reed v. Reed","Roe v. Wade","Regents of the University of California v. Bakke"
590,"In the case of Regents of the University of California v. Bakke, the Court","refused to allow the admission of Bakke to University of California-Davis.","was united in its decision.","ordered that University of California-Davis could not use race as a criterion for admission.","ruled that nursing schools cannot discriminate against men in their admissions procedures.","ruled that a public university could not set aside a quota of spots for particular groups.","ruled that a public university could not set aside a quota of spots for particular groups."
591,"Which of the following statements about Supreme Court rulings concerning affirmative actionis FALSE?","The Court has approved preferential treatment of minorities in promotions.","The Court has ruled that affirmative action can exempt recently hired minorities from traditional work rules specifying   last hired, first fired   order of layoffs.","The Court has ordered quotas for minority union memberships.","The Court has ruled that public employers may use affirmative action promotion plans to counter the underrepresentation of women and minorities in the workplace.","none of the above","The Court has ruled that affirmative action can exempt recently hired minorities from traditional work rules specifying   last hired, first fired   order of layoffs."
592,"Affirmative action programs are referred to by critics as","negative reaction.","reverse discrimination.","positive negativism.","comparable worth.","degenderizing.","reverse discrimination."
593,"Supporters of affirmative action believe that","affirmative action produces so important a social goal that some reverse discrimination is acceptable.","merit is the only fair basis for distributing benefits.","discrimination is wrong, even when its purpose is to rectify past injustices.","any form of quota system is unjust.","some discrimination is acceptable.","affirmative action produces so important a social goal that some reverse discrimination is acceptable."
594,"When proposition 209 was passed in California in 1996, it banned","affirmative action in public hiring, contracting, and educational admissions.","affirmative action in federal hiring.","affirmative action on behalf of homosexuals.","affirmative action in the private sector.","affirmative action on behalf of women.","affirmative action in public hiring, contracting, and educational admissions."
595,"Which of the following statements is FALSE?","Civil rights policies have expanded the power of government.","The steady expansion of civil rights has brought more groups into the democratic process.","Current civil rights policies conform to the eighteenth-century idea of limited government.","The rights ensured by the First Amendment are essential to a democracy.","Lyndon Johnson was president when civil rights legislation was passed in the 1960s.","Current civil rights policies conform to the eighteenth-century idea of limited government."
595,"Which of the following statements is FALSE?","Civil rights policies have expanded the power of government.","The steady expansion of civil rights has brought more groups into the democratic process.","Current civil rights policies conform to the eighteenth-century idea of limited government.","The rights ensured by the First Amendment are essential to a democracy.","Lyndon Johnson was president when civil rights legislation was passed in the 1960s.","Current civil rights policies conform to the eighteenth-century idea of limited government."
597,"The science of population changes is","polling.","anthropology.","popuology.","demography.","the census.","demography."
598,"The most valuable method for understanding demographic changes in America is the","Statistical Abstract of the United States.","public opinion poll.","census.","turnout in presidential elections.","Internal Revenue Service statistical tax abstracts.","census."
599,"________ is the distribution of the population's beliefs about politics and policy issues.","Random sampling","Direct mail","Political socialization","Public opinion","Political ideology","Public opinion"
600,"Which of the following statements about the American people is FALSE?","There are about 295 million Americans.","Most Americans view cultural diversity as one of the least appealing aspects of their society.","America is one of the most culturally diverse countries in the world.","America was founded on the principle of tolerating diversity.","none of the above","Most Americans view cultural diversity as one of the least appealing aspects of their society."
601,"The science of population changes is called","public opinion.","demography.","political science.","census.","popuology.","demography."
602,"Public opinion is defined in the text as","opinions which are expressible in public, as opposed to the more truthful private opinions which most individuals are reluctant to state publicly.","beliefs about government held by a majority of people.","opinions solicited from a random sample of the public.","the distribution of the population's beliefs about politics and policy.","widely held beliefs about the public's role in politics and policy.","the distribution of the population's beliefs about politics and policy."
603,"By constitutional requirement, the government conducts the United States Census every","two years.","year.","five years.","presidential election year.","ten years.","ten years."
604,"The United States Constitution requires that the government conduct an   actual enumeration  of the population every","ten years.","25 years.","year.","five years.","presidential election year.","ten years."
605,"The first census in the United States was conducted in","1900.","1790.","1970.","1850.","1800.","1790."
606,"An issue that became controversial regarding the 1990 census was","inclusion of immigrants.","cost of the census.","the undercount of minority groups.","the overcount of urbanites.","none of the above","the undercount of minority groups."
607,"The 2000 census indicated that the largest minority population is comprised of","illegals.","African Americans.","Asian Americans.","Hispanics.","Native Americans.","Hispanics."
608,"Approximately what percent of African Americans live below the poverty line?","28","42","25","6","17","25"
609,"The largest racial/ethnic minority group in the United States is","African Americans.","Asian Americans.","Native Americans.","Hispanics.","African Americans and Hispanics are tied in size.","Hispanics."
610,"Approximately what percent of Asian Americans hold a college degree?","32","49","12","22","60","49"
611,"The least healthy, poorest, and least educated racial/ethnic group in the United States is","African Americans.","Native Americans.","Asian Americans.","Hispanics.","Caucasians.","Native Americans."
612,"The most recent wave of immigration since World War II has consisted primarily of","Africans.","Hispanics and Asians.","northwestern Europeans.","southern and eastern Europeans.","refugees from communist countries.","Hispanics and Asians."
613,"Demographic changes in the United States population could translate to political consequencesthrough the process of","political socialization.","political acculturation.","reapportionment.","political assimilation","none of the above","reapportionment."
614,"The term   minority majority   refers to the fact that","the majority in America has always been a collection of minority ethnic groups.","minority groups have been able to impose their will upon the majority.","America will soon cease to have a white majority and together the minority groups will become a majority.","African Americans are the largest minority group in the United States.","Hispanic Americans will soon become the largest minority group in the United States.","America will soon cease to have a white majority and together the minority groups will become a majority."
615,"African Americans comprise what proportion of the American population?","about 30 percent","about 25 percent","about 12 percent","about 20 percent","about 5 percent","about 12 percent"
616,"Hispanics comprise approximately what percent of the American population?","13 percent","5 percent","23 percent","18 percent","28 percent","13 percent"
617,"The largest component of the minority majority is the","Asian population.","Caucasian population.","Hispanic population.","Native-American population.","African-American population.","Hispanic population."
618,"Which of the following statements is FALSE?","Hispanics are primarily concentrated in the rural areas.","In the 2000 Census, the Hispanic population outnumbered the African -American population.","African Americans have recently been exercising a good deal of political power.","about 24 percent of African Americans currently live under the poverty line.","none of the above","Hispanics are primarily concentrated in the rural areas."
619,"Unlike Hispanics who have come to America to escape poverty, the recent influx of Asians hasbeen driven by","upper-class elites who feared political persecution.","civil wars.","a new class of professionals looking for greater opportunity.","ethnic minorities seeking refuge from human rights violations.","B and C only","a new class of professionals looking for greater opportunity."
620,"Native Americans tend to be","the poorest group in America.","the least educated group in America.","the least healthy group in America.","all of the above","none of the above","all of the above"
621,"The Simpson-Mazzoli Act","represented a crackdown on illegal aliens by requiring that employers document the citizenship or legitimate immigrant status of workers or pay stiff fines.","requires that states keep their polls open for at least ten hours on election day in order to facilitate participation.","established federal guidelines and regulations for taking public opinion polls.","reformed the jury procedures in felony cases, particularly the unanimous verdict requirement.","required that the homeless be counted in the 1990 census.","represented a crackdown on illegal aliens by requiring that employers document the citizenship or legitimate immigrant status of workers or pay stiff fines."
